<?xml version="1.0" encoding="UTF-8"?>
<xs:schema xmlns:xs="http://www.w3.org/2001/XMLSchema" targetNamespace="http://www.uniovi.es" xmlns="http://www.uniovi.es" elementFormDefault="qualified">
	<xs:element name="rutas">
		<xs:complexType>
			<xs:sequence>
				<xs:element minOccurs="1" maxOccurs="unbounded" ref="ruta" />
			</xs:sequence>
		</xs:complexType>
	</xs:element>
	<xs:element name="ruta">
		<xs:complexType>
			<xs:sequence>
				<xs:element ref="medio-transporte" />
				<xs:element minOccurs="0" maxOccurs="1" ref="inicio-ruta" />
				<xs:element ref="duracion" />
				<xs:element ref="agencia" />
				<xs:element ref="descripcion" />
				<xs:element ref="personas-adecuadas" />
				<xs:element ref="lugar-inicio" />
				<xs:element ref="direccion-inicio" />
				<xs:element ref="coordenadas" />
				<xs:element ref="referencias-bibliografia" />
				<xs:element ref="recomendacion" />
				<xs:element ref="hitos" />
			</xs:sequence>
			<xs:attribute name="nombre" type="xs:string" use="required" />
			<xs:attribute name="tipo" type="xs:string" use="required" />
		</xs:complexType>
	</xs:element>
	<xs:element name="nombre" type="xs:string" />
	<xs:element name="tipo" type="xs:string" />
	<xs:element name="medio-transporte" type="xs:string" />
	<xs:element name="inicio-ruta" type="xs:dateTime" />
	<xs:element name="duracion" type="xs:duration" />
	<xs:element name="agencia" type="xs:string" />
	<xs:element name="descripcion" type="xs:string" />
	<xs:element name="personas-adecuadas" type="xs:string" />
	<xs:element name="lugar-inicio" type="xs:string" />
	<xs:element name="direccion-inicio" type="xs:string" />
	<xs:element name="coordenadas">
		<xs:complexType>
			<xs:simpleContent>
				<xs:extension base="xs:string">
					<xs:attribute name="longitud" type="xs:float" use="required" />
					<xs:attribute name="latitud" type="xs:float" use="required" />
					<xs:attribute name="altitud" type="xs:integer" use="required" />
				</xs:extension>
			</xs:simpleContent>
		</xs:complexType>
	</xs:element>
	<xs:element name="longitud" type="xs:float" />
	<xs:element name="latitud" type="xs:float" />
	<xs:element name="altitud" type="xs:integer" />
	<xs:element name="referencias-bibliografia">
		<xs:complexType>
			<xs:sequence>
				<xs:element minOccurs="3" maxOccurs="unbounded" ref="referencia-bibliografia" />
			</xs:sequence>
		</xs:complexType>
	</xs:element>
	<xs:element name="referencia-bibliografia" type="xs:string" />
	<xs:element name="recomendacion" >
		<xs:simpleType>
			<xs:restriction base="xs:integer">
				<xs:minInclusive value="0"></xs:minInclusive>
				<xs:maxInclusive value="10"></xs:maxInclusive>
			</xs:restriction>
		</xs:simpleType>
	</xs:element>
	<xs:element name="hitos">
		<xs:complexType>
			<xs:sequence>
				<xs:element minOccurs="3" maxOccurs="unbounded" ref="hito" />
			</xs:sequence>
		</xs:complexType>
	</xs:element>
	<xs:element name="hito">
		<xs:complexType>
			<xs:sequence>
				<xs:element ref="nombre-hito" />
				<xs:element ref="descripcion-hito" />
				<xs:element ref="coordenadas" />
				<xs:element ref="distancia" />
				<xs:element ref="galeria-fotografia" />
				<xs:element minOccurs="0" maxOccurs="1" ref="galeria-video" />
			</xs:sequence>
		</xs:complexType>
	</xs:element>
	<xs:element name="nombre-hito" type="xs:string" />
	<xs:element name="descripcion-hito" type="xs:string" />
	<xs:element name="distancia">
		<xs:complexType>
			<xs:simpleContent>
				<xs:extension base="xs:integer">
					<xs:attribute name="unidades" type="xs:string" use="required" />
				</xs:extension>
			</xs:simpleContent>
		</xs:complexType>
	</xs:element>
	<xs:element name="galeria-fotografia">
		<xs:complexType>
			<xs:sequence>
				<xs:element minOccurs="1" maxOccurs="5" ref="fotografia" />
			</xs:sequence>
		</xs:complexType>
	</xs:element>
	<xs:element name="fotografia" type="xs:string" />
	<xs:element name="galeria-video">
		<xs:complexType>
			<xs:sequence>
				<xs:element minOccurs="0" maxOccurs="3" ref="video" />
			</xs:sequence>
		</xs:complexType>
	</xs:element>
	<xs:element name="video" type="xs:string" />
</xs:schema>